Company,Date,News Headline,Source,URL
Microsoft,2024-08-26T16:32:02Z,Leaked Microsoft pay data shows how much more AI employees make versus the rest of the company,Business Insider,https://www.businessinsider.com/microsoft-pay-data-shows-how-much-more-ai-workers-make-2024-8
Microsoft,2024-08-02T13:00:00Z,Surface Pro 11 review: tantalizingly close to the dream,The Verge,https://www.theverge.com/24191243/microsoft-surface-pro-11-oled-review
Microsoft,1970-01-01T00:00:00Z,[Removed],[Removed],https://removed.com
Microsoft,2024-08-08T23:22:16Z,Computer Crash Reports Are an Untapped Hacker Goldmine,Wired,https://www.wired.com/story/crash-reports-vulnerability-data/
Microsoft,2024-08-13T13:34:41Z,New book says Bill Gates was envious of Steve Jobs' magnetism: 'How does he do that?',Business Insider,https://www.businessinsider.com/microsoft-bill-gates-jealous-apple-steve-jobs-magnetism-book-2024-8
Microsoft,2024-08-27T09:07:02Z,I interned at JP Morgan and Microsoft as a software engineer. This is my secret to landing offers.,Business Insider,https://www.businessinsider.com/how-to-get-software-engineering-internships-at-jp-morgan-microsoft-2024-8
Microsoft,2024-08-22T09:00:01Z,Leaked Microsoft pay data shows how much hundreds of software engineers report making in units like Azure and AI,Business Insider,https://www.businessinsider.com/microsoft-spreadsheet-shows-pay-engineers-2024-8
Microsoft,2024-08-06T09:26:02Z,"Sweaty, desperate, and sad: Big Tech is giving off divorced dad energy",Business Insider,https://www.businessinsider.com/tech-industry-divorced-dad-energy-google-microsoft-amazon-innovation-2024-8
Microsoft,2024-08-21T16:55:20Z,The founder of a software-development company says there's a 'huge demand' for training and education applications — extended reality can help,Business Insider,https://www.businessinsider.com/treeview-extended-reality-artificial-intelligence-software-development-metaverse-2024-8
Microsoft,2024-08-28T15:09:26Z,"Satya Nadella's career rise, from computer science student to turning Microsoft into a $3 trillion titan as CEO",Business Insider,https://www.businessinsider.com/microsoft-ceo-satya-nadella-career-rise
Microsoft,2024-08-01T11:15:50Z,The Morning After: Squid Game returns on December 26,Yahoo Entertainment,https://consent.yahoo.com/v2/collectConsent?sessionId=1_cc-session_7dc115ad-7788-48b1-9083-8e815f7280d6
Microsoft,2024-08-27T19:40:54Z,X is working on its own version of Zoom for some reason,Yahoo Entertainment,https://consent.yahoo.com/v2/collectConsent?sessionId=1_cc-session_904f5db4-cc7c-4270-8090-2b89bda81f1c
Microsoft,2024-08-14T18:35:25Z,Taylor Swift Pulling a 9/11 Gives Companies a Whole New Reason to Advertise on X,Gizmodo.com,https://gizmodo.com/taylor-swift-pulling-a-9-11-gives-companies-a-whole-new-reason-to-advertise-on-x-2000487130
Microsoft,2024-07-31T23:43:39Z,Tech giants: AI will transform 92% of ICT jobs; we must upskill now,VentureBeat,https://venturebeat.com/ai/tech-giants-ai-will-transform-92-of-ict-jobs-we-must-upskill-now/
Microsoft,2024-08-05T19:02:19Z,Judge rules that Google ‘is a monopolist’ in US antitrust case,The Verge,https://www.theverge.com/2024/8/5/24155520/judge-rules-on-us-doj-v-google-antitrust-search-suit
Microsoft,2024-07-31T21:29:23Z,Qualcomm promises Snapdragon X PCs will cost as little as $700 next year,The Verge,https://www.theverge.com/2024/7/31/24210783/qualcomm-promises-snapdragon-x-pcs-will-cost-as-little-as-700-next-year
Microsoft,2024-08-09T17:40:34Z,"Google lost its first antitrust case, so what happens next?",The Verge,https://www.theverge.com/2024/8/9/24216708/google-lost-antitrust-elon-musk-sues-advertisers
Microsoft,2024-08-20T16:54:37Z,Authors sue Anthropic for training AI using pirated books,The Verge,https://www.theverge.com/2024/8/20/24224450/anthropic-copyright-lawsuit-pirated-books-ai
Microsoft,2024-08-21T21:59:00Z,Microsoft confirma la muerte del Panel de Control de Windows,Hipertextual,http://hipertextual.com/2024/08/microsoft-confirma-muerte-panel-de-control-windows
Microsoft,2024-08-12T17:10:47Z,Microsoft eliminará otra aplicación clásica de Windows este año,Hipertextual,http://hipertextual.com/2024/08/microsoft-elimina-paint-3d-windows-store
Microsoft,2024-08-16T18:01:00Z,Microsoft elimina el límite arbitrario de FAT32 en Windows,Hipertextual,http://hipertextual.com/2024/08/microsoft-elimina-el-limite-arbitrario-de-fat32-en-windows
Microsoft,2024-08-09T20:11:51Z,Microsoft detects fake news sites linked to Iran aimed at meddling in U.S. election,NPR,https://www.npr.org/2024/08/09/nx-s1-5069317/iran-interfere-presidential-election-microsoft-report
Microsoft,2024-07-31T14:40:00Z,Delta CEO Says CrowdStrike-Microsoft Outage Cost the Airline $500 Million,Slashdot.org,https://slashdot.org/story/24/07/31/1325235/delta-ceo-says-crowdstrike-microsoft-outage-cost-the-airline-500-million
Microsoft,2024-08-11T07:34:00Z,Some Def Con Attendees Forgive Crowdstrike - and Some Blame Microsoft Windows,Slashdot.org,https://it.slashdot.org/story/24/08/11/0520231/some-def-con-attendees-forgive-crowdstrike---and-some-blame-microsoft-windows
Microsoft,2024-08-15T17:25:00Z,"German Cyber Agency Wants Changes in Microsoft, CrowdStrike Products After Tech Outage",Slashdot.org,https://it.slashdot.org/story/24/08/15/1725216/german-cyber-agency-wants-changes-in-microsoft-crowdstrike-products-after-tech-outage
Microsoft,2024-08-22T16:48:00Z,Microsoft Will Try the Data-Scraping Windows Recall Feature Again in October,Slashdot.org,https://tech.slashdot.org/story/24/08/22/1648253/microsoft-will-try-the-data-scraping-windows-recall-feature-again-in-october
Microsoft,2024-08-01T14:00:00Z,Reddit CEO Says Microsoft and Others Need To Pay To Search the Site,Slashdot.org,https://tech.slashdot.org/story/24/08/01/1129247/reddit-ceo-says-microsoft-and-others-need-to-pay-to-search-the-site
Microsoft,2024-08-21T00:40:00Z,"'Something Has Gone Seriously Wrong,' Dual-Boot Systems Warn After Microsoft Update",Slashdot.org,https://tech.slashdot.org/story/24/08/21/0031243/something-has-gone-seriously-wrong-dual-boot-systems-warn-after-microsoft-update
Microsoft,2024-08-01T07:49:20Z,"Reddit's CEO says Microsoft, Anthropic, and Perplexity scraping content is 'a real pain in the ass'",Business Insider,https://www.businessinsider.com/reddit-slams-microsoft-anthropic-perplexity-ai-training-llms-model-licensing-2024-8
Microsoft,2024-08-27T20:00:00Z,Microsoft no matará al Panel de Control de Windows (por ahora),Hipertextual,http://hipertextual.com/2024/08/microsof-no-matara-panel-control-windows
Microsoft,2024-08-14T12:45:21Z,DOJ Considering Breaking Up Google After Monopoly Ruling: Report,Gizmodo.com,https://gizmodo.com/doj-considering-breaking-up-google-after-monopoly-ruling-report-2000486766
Microsoft,2024-08-30T19:37:55Z,Palantir Technologies Inc. (NYSE:PLTR): Microsoft Deal Is Game Changing,Yahoo Entertainment,https://finance.yahoo.com/news/palantir-technologies-inc-nyse-pltr-193755344.html
Microsoft,2024-07-31T16:20:27Z,"Microsoft down: Outage was caused by cyber attack, company says",Yahoo Entertainment,https://consent.yahoo.com/v2/collectConsent?sessionId=1_cc-session_ec6ab179-ef61-423e-a6d8-578c7fc7fa16
Microsoft,2024-08-23T15:28:45Z,Microsoft to host cybersecurity summit after CrowdStrike-induced IT outage,Yahoo Entertainment,https://consent.yahoo.com/v2/collectConsent?sessionId=1_cc-session_4cca4057-12d3-418d-b9c6-3bc3866d4192
Microsoft,2024-08-22T22:38:25Z,Google Essentials will house all Google services in a single Windows app,Yahoo Entertainment,https://consent.yahoo.com/v2/collectConsent?sessionId=1_cc-session_7fe873e6-c8d8-4a70-baa5-78fbc6721c70
Microsoft,2024-08-20T19:30:00Z,Microsoft Teams implementa la función más pedida en su nueva app para Mac y PC,Hipertextual,http://hipertextual.com/2024/08/microsoft-teams-implementa-cuentas-unificadas-mac-pc
Microsoft,2024-08-09T19:40:00Z,Microsoft lanzaría su propio Apple Vision Pro con ayuda de Samsung,Hipertextual,http://hipertextual.com/2024/08/microsoft-lanzaria-su-propio-apple-vision-pro-con-ayuda-de-samsung
Microsoft,2024-08-15T20:46:00Z,Microsoft ya no te hostigará para que actualices tu PC a Windows 11,Hipertextual,http://hipertextual.com/2024/08/microsoft-ya-no-te-hostigara-para-que-actualices-a-windows-11
Microsoft,2024-08-21T14:55:55Z,Microsoft abre las reservas de la nueva Xbox Series X sin lectora de discos y confirma su fecha de lanzamiento,Hipertextual,http://hipertextual.com/2024/08/microsoft-abre-las-reservas-de-la-nueva-xbox-series-x-solo-digital
Microsoft,2024-08-30T18:14:25Z,Microsoft añade una de las funciones más útiles de su IA en Word,Hipertextual,http://hipertextual.com/2024/08/microsoft-word-resumentes-inteligencia-artificial-copilot
Microsoft,2024-07-31T12:21:14Z,Microsoft's timeline for its massive AI bet is testing everyone's patience,Business Insider,https://www.businessinsider.com/microsoft-ai-satya-nadella-tech-payoff-investment
Microsoft,2024-07-31T19:20:00Z,"Microsoft says cyberattack triggered Azure outage that impacted Outlook, Starbucks app and more",Fast Company,https://www.fastcompany.com/91165872/microsoft-azure-outage-outlook-starbucks-app-cyberattack
Microsoft,2024-08-24T14:00:36Z,Microsoft apps on macOS could be your biggest privacy threat,Fox News,https://www.foxnews.com/tech/microsoft-apps-macos-could-your-biggest-privacy-threat
Microsoft,2024-08-06T18:38:13Z,Microsoft lashes out at Delta: Your ancient tech caused the service meltdown,CNN,https://www.cnn.com/2024/08/06/business/microsoft-crowdstrike-outage-delta?cid=external-feeds_iluminar_yahoo
Microsoft,2024-08-04T12:00:00Z,"As AI gobbles electricity, is now the time to buy unloved utility stocks?",Yahoo Entertainment,https://finance.yahoo.com/news/ai-gobbles-electricity-now-time-120000986.html
Microsoft,2024-08-17T20:34:00Z,"Paul Allen's Estate Auction Includes Vintage Apple-1, CP/M and DOS-Powered Computers",Slashdot.org,https://slashdot.org/story/24/08/17/1949252/paul-allens-estate-auction-includes-vintage-apple-1-cpm-and-dos-powered-computers
Microsoft,2024-08-05T22:10:49Z,"‘You are a helpful mail assistant,’ and other Apple Intelligence instructions",The Verge,https://www.theverge.com/2024/8/5/24213861/apple-intelligence-instructions-macos-15-1-sequoia-beta
Microsoft,2024-07-31T11:00:13Z,Play Call of Duty: Modern Warfare 3 and More on Xbox Game Pass Now,CNET,https://www.cnet.com/tech/gaming/play-call-of-duty-modern-warfare-3-and-more-on-xbox-game-pass-now/
Microsoft,2024-08-09T12:30:06Z,How to download Microsoft Word,Digital Trends,https://www.digitaltrends.com/computing/how-to-download-microsoft-word/
Microsoft,2024-08-23T21:00:52Z,How to download Microsoft PowerPoint,Digital Trends,https://www.digitaltrends.com/computing/how-to-download-microsoft-powerpoint/
Microsoft,2024-08-01T18:00:54Z,America’s Cyber Security Agency Picks Its First Head of AI,Gizmodo.com,https://gizmodo.com/americas-cyber-security-agency-picks-its-first-head-of-ai-2000482281
Microsoft,2024-08-05T20:25:14Z,Crowdstrike Tells Delta It ‘Wasn’t Grossly Negligent’ When It Started a Global Outage,Gizmodo.com,https://gizmodo.com/crowdstrike-tells-delta-it-wasnt-grossly-negligent-when-it-started-a-global-outage-2000483288
Microsoft,2024-08-29T22:15:42Z,Labor Day Deal: Enjoy the Enhanced UI of Windows 11 Pro for 89% off,Gizmodo.com,https://gizmodo.com/labor-day-deal-enjoy-the-enhanced-ui-of-windows-11-pro-for-89-off-2000492532
Microsoft,2024-08-08T13:45:12Z,Sci-Fi Writer Releases Free Archive of Legendary Word Processor Used by George RR Martin,Gizmodo.com,https://gizmodo.com/sci-fi-writer-releases-free-archive-of-legendary-word-processor-used-by-george-rr-martin-2000484618
Microsoft,2024-08-19T18:00:36Z,Historical Microsoft and Apple Artifacts Among First Christie’s Auction of Living Computers Museum,Hackaday,https://hackaday.com/2024/08/19/historical-microsoft-and-apple-artifacts-among-first-christies-auction-of-living-computers-museum/
Microsoft,2024-08-21T14:05:00Z,Microsoft's White Xbox Series X and 2TB Special-edition Model Launching in October,Slashdot.org,https://games.slashdot.org/story/24/08/21/145259/microsofts-white-xbox-series-x-and-2tb-special-edition-model-launching-in-october
Microsoft,2024-08-02T09:31:22Z,Hasta ahora Microsoft y OpenAI eran grandes aliadas. Hasta ahora,Xataka.com,https://www.xataka.com/robotica-e-ia/ahora-microsoft-openai-eran-grandes-aliadas-ahora
Microsoft,2024-08-07T00:03:20Z,Apple prefirió el buscador de Google porque Bing era «horrible»,Hipertextual,http://hipertextual.com/2024/08/apple-prefirio-google-porque-bing-era-horrible
Microsoft,2024-08-17T15:49:13Z,OpenAI says Iranian group using ChatGPT tried to sow division ahead of U.S. election,NPR,https://www.npr.org/2024/08/17/nx-s1-5079397/openai-chatgpt-iranian-group-us-election
Microsoft,2024-08-12T23:34:09Z,FBI is investigating after Trump campaign says Iran hacked sensitive documents,NPR,https://www.npr.org/2024/08/12/g-s1-16687/fbi-trump-campaign-iran-hack-investigation
Google,2024-08-22T22:38:25Z,Google Essentials will house all Google services in a single Windows app,Yahoo Entertainment,https://consent.yahoo.com/v2/collectConsent?sessionId=1_cc-session_7fe873e6-c8d8-4a70-baa5-78fbc6721c70
Google,2024-08-06T13:00:00Z,"Google 4th-Gen Nest Learning Thermostat and Google TV Streamer: Specs, Features, Price, Release Date",Wired,https://www.wired.com/story/google-nest-learning-thermostat-4th-gen-google-tv-streamer/
Google,2024-08-09T11:30:28Z,Engadget Podcast: The Google search monopoly + 'Industry' creator interview,Yahoo Entertainment,https://consent.yahoo.com/v2/collectConsent?sessionId=1_cc-session_b495d808-cfb3-43e8-baee-60fb5e5964ba
Google,1970-01-01T00:00:00Z,[Removed],[Removed],https://removed.com
Google,2024-08-07T11:15:23Z,The Morning After: Google replaces Chromecast with the TV Streamer,Yahoo Entertainment,https://consent.yahoo.com/v2/collectConsent?sessionId=1_cc-session_73ad17a2-94a9-45d1-b0dc-7f996270e661
Google,1970-01-01T00:00:00Z,[Removed],[Removed],https://removed.com
Google,2024-07-31T13:00:00Z,Google Maps is getting even more like Waze,The Verge,https://www.theverge.com/2024/7/31/24209969/google-maps-destination-guidance-waze-camera-events
Google,2024-08-10T06:43:13Z,Long-time Google exec Susan Wojcicki has died at 56,The Verge,https://www.theverge.com/2024/8/10/24217307/susan-wojcicki-youtube-ceo-google-exec-dies
Google,2024-07-31T13:00:00Z,Google tweaks Search to help hide explicit deepfakes,The Verge,https://www.theverge.com/2024/7/31/24210283/google-search-update-remove-explicit-deepfakes-results
Google,2024-08-09T17:40:34Z,"Google lost its first antitrust case, so what happens next?",The Verge,https://www.theverge.com/2024/8/9/24216708/google-lost-antitrust-elon-musk-sues-advertisers
Google,1970-01-01T00:00:00Z,[Removed],[Removed],https://removed.com
Google,2024-08-05T19:33:58Z,"Google 'is a monopolist' in search, US judge rules in antitrust case",Yahoo Entertainment,https://consent.yahoo.com/v2/collectConsent?sessionId=1_cc-session_b56e8c88-d812-47bf-9d71-eedaf814b354
Google,2024-07-31T17:30:01Z,Google Declares War on Deepfake Porn,Gizmodo.com,https://gizmodo.com/google-declares-war-on-deepfake-porn-2000481593
Google,2024-08-06T15:00:37Z,It’s Official: Google Is a Monopoly,Gizmodo.com,https://gizmodo.com/its-official-google-is-a-monopoly-2000483619
Google,2024-08-02T13:51:25Z,The Google Pixel 8a drops to a new low of $399,Yahoo Entertainment,https://consent.yahoo.com/v2/collectConsent?sessionId=1_cc-session_bcabd6fc-b5f0-4d9f-bfd4-f8041ea59933
Google,1970-01-01T00:00:00Z,[Removed],[Removed],https://removed.com
Google,1970-01-01T00:00:00Z,[Removed],[Removed],https://removed.com
Google,2024-08-12T21:02:17Z,The Made by Google Pixel 9 launch event kicks off tomorrow. Here's what we expect,Yahoo Entertainment,https://consent.yahoo.com/v2/collectConsent?sessionId=1_cc-session_781f62a8-ce47-4c13-a7e3-36e534550b49
Google,2024-08-12T16:12:07Z,Made by Google Pixel event: how to watch on August 13,Yahoo Entertainment,https://consent.yahoo.com/v2/collectConsent?sessionId=1_cc-session_674b7bf2-e15c-4919-908a-412bd927664d
Google,2024-08-15T18:59:28Z,Researchers claim most Google Pixel phones shipped with exploitable bloatware since 2017,Yahoo Entertainment,https://consent.yahoo.com/v2/collectConsent?sessionId=1_cc-session_7dbb0e42-0870-42b0-8a9a-90ae27d6d880
Google,2024-08-15T20:22:46Z,Online publishers face a dilemma: Allow AI scraping from Google or lose search visibility,Yahoo Entertainment,https://consent.yahoo.com/v2/collectConsent?sessionId=1_cc-session_dc87e039-3dd3-4a02-82df-75decd5b48ca
Google,1970-01-01T00:00:00Z,[Removed],[Removed],https://removed.com
Google,1970-01-01T00:00:00Z,[Removed],[Removed],https://removed.com
Google,2024-08-15T20:00:21Z,California state IDs can now be stored in Apple Wallet and Google Wallet,Yahoo Entertainment,https://consent.yahoo.com/v2/collectConsent?sessionId=1_cc-session_4d882fc4-77c8-4343-993d-5f90793d52c6
Google,2024-08-16T21:05:31Z,"Google acknowledges it ""missed the mark"" with Team Pixel program language for Pixel 9 reviews",Yahoo Entertainment,https://consent.yahoo.com/v2/collectConsent?sessionId=1_cc-session_615f4ba9-db3f-4b1e-b86b-261f459b639e
Google,2024-08-21T12:00:00Z,"Best Distraction-Free Writing Apps: iA Writer, Ulysses, FocusWriter, Google Docs, Obsidian",Wired,https://www.wired.com/story/best-apps-for-distraction-free-writing/
Google,2024-08-05T13:00:00Z,Zoom Is Going After Google and Microsoft With AI-Driven Docs,Wired,https://www.wired.com/story/zoom-is-going-after-google-and-microsoft-with-ai-driven-docs/
Google,2024-08-15T13:00:00Z,Nearly All Google Pixel Phones Are Left Exposed by Unpatched Flaw in Hidden Android App,Wired,https://www.wired.com/story/google-android-pixel-showcase-vulnerability/
Google,2024-08-14T22:27:03Z,"A Single Iranian Hacker Group Targeted Both Presidential Campaigns, Google Says",Wired,https://www.wired.com/story/iran-apt42-trump-biden-harris-phishing-targeting/
Google,2024-08-12T09:00:00Z,"How to Watch the Made by Google Pixel 9 Launch Event, and What to Expect",Wired,https://www.wired.com/story/made-by-google-2024-pixel-9-launch-event-how-to-watch-what-to-expect/
Google,2024-08-05T14:57:26Z,Donald Trump says Google ‘has to be careful’ or it will be ‘shut down’,The Verge,https://www.theverge.com/2024/8/5/24212296/trump-vance-google-shut-down-first-amendment
Google,2024-08-05T19:02:19Z,Judge rules that Google ‘is a monopolist’ in US antitrust case,The Verge,https://www.theverge.com/2024/8/5/24155520/judge-rules-on-us-doj-v-google-antitrust-search-suit
Google,2024-08-22T14:03:06Z,Google reaches a $250 million deal to skirt proposed journalism bill,The Verge,https://www.theverge.com/2024/8/22/24225986/google-california-newsroom-deal-cjpa-journalism
Google,2024-08-13T17:00:40Z,Say Goodbye to Google Assistant and Hello to Gemini Live,Gizmodo.com,https://gizmodo.com/say-goodbye-to-the-google-assistant-on-android-hello-to-gemini-live-2000486157
Google,2024-08-23T13:30:46Z,Which Google Pixel 9 Is Right for You?,Gizmodo.com,https://gizmodo.com/which-google-pixel-9-is-right-for-you-2000489752
Google,2024-08-14T12:45:21Z,DOJ Considering Breaking Up Google After Monopoly Ruling: Report,Gizmodo.com,https://gizmodo.com/doj-considering-breaking-up-google-after-monopoly-ruling-report-2000486766
Google,2024-08-02T11:05:16Z,Google Gemini Might Soon Question Your Taste in Music,Gizmodo.com,https://gizmodo.com/google-gemini-might-soon-question-your-taste-in-music-2000482245
Google,2024-08-04T00:36:01Z,Google Says AI Olympics Ad ‘Tested Well’ Before Inspiring Outrage,Gizmodo.com,https://gizmodo.com/google-says-ai-olympics-ad-tested-well-before-inspiring-outrage-2000482900
Google,1970-01-01T00:00:00Z,[Removed],[Removed],https://removed.com
Google,1970-01-01T00:00:00Z,[Removed],[Removed],https://removed.com
Google,2024-07-31T17:30:00Z,What to expect from Google’s Pixel 9 event,The Verge,https://www.theverge.com/2024/7/31/24208625/google-pixel-hardware-event-august-2024-leaks
Google,2024-08-15T00:00:25Z,Ex-Google CEO says successful AI startups can steal IP and hire lawyers to ‘clean up the mess’,The Verge,https://www.theverge.com/2024/8/14/24220658/google-eric-schmidt-stanford-talk-ai-startups-openai
Google,2024-08-10T11:00:20Z,Former YouTube CEO Susan Wojcicki has died,Yahoo Entertainment,https://consent.yahoo.com/v2/collectConsent?sessionId=1_cc-session_f7b0f0f5-7e3e-4cea-876d-4e2821fda2b4
Google,2024-08-28T10:00:00Z,"Signal Is More Than Encrypted Messaging. Under Meredith Whittaker, It’s Out to Prove Surveillance Capitalism Wrong",Wired,https://www.wired.com/story/meredith-whittaker-signal/
Google,2024-08-12T15:04:10Z,Pixel Buds Pro 2 could come with better active noise cancellation,The Verge,https://www.theverge.com/2024/8/12/24218594/pixel-buds-pro-2-better-active-noise-cancellation
Google,2024-08-08T17:00:13Z,Google Beefs Up Android’s Second-Favorite Weather App in Time for the Pixel 9,Gizmodo.com,https://gizmodo.com/google-beefs-up-androids-second-favorite-weather-app-in-time-for-the-pixel-9-2000484725
Google,2024-08-10T10:00:52Z,How (and When) to Use Gemini AI in Gmail and Google Docs,Gizmodo.com,https://gizmodo.com/how-and-when-to-use-gemini-ai-in-gmail-and-google-docs-2000484837
Google,2024-08-21T17:12:17Z,Google Pixel 9 Pro XL Early Review: Google’s Android Phone Is Doing Its Best iPhone Impression,Gizmodo.com,https://gizmodo.com/google-pixel-9-pro-xl-review-2000489196
Google,2024-08-13T17:00:49Z,Google Pixel Watch 3 Hands On: A Big Screen for Big Wrists,Gizmodo.com,https://gizmodo.com/google-pixel-watch-3-hands-on-a-big-screen-for-big-wrists-2000486355
Google,2024-08-13T17:00:23Z,Google Pixel 9 Pro Fold Hands On: Still Playing Catch-up,Gizmodo.com,https://gizmodo.com/google-pixel-9-pro-fold-hands-on-still-playing-catch-up-2000485931
Google,2024-08-13T17:00:58Z,Google Pixel 9 Hands On: Pixels With Extra Size and Extra AI,Gizmodo.com,https://gizmodo.com/google-pixel-9-hands-on-pixels-with-extra-size-and-extra-ai-2000486055
Google,2024-08-13T16:35:01Z,Google Wallet Just Made it Easier to Turn Anything Into a Digital Pass,Gizmodo.com,https://gizmodo.com/google-wallet-just-made-it-easier-to-organize-your-digital-keys-2000486298
Google,2024-08-13T17:44:10Z,The Google Pixel’s Best Accessibility Features are Now Easier to Use,Gizmodo.com,https://gizmodo.com/google-pixels-best-accessibility-features-are-now-easier-to-use-2000486385
Google,2024-08-06T13:05:06Z,"The Google Nest Learning Thermostat Looks Like a Giant Pixel Watch, and That’s the Point",Gizmodo.com,https://gizmodo.com/the-google-nest-learning-thermostat-looks-like-a-giant-pixel-watch-and-thats-the-point-2000483437
Google,2024-07-31T17:51:44Z,"Google, Meta Debunk Claims They Were Hiding Details About Trump Assassination Attempt",Gizmodo.com,https://gizmodo.com/google-meta-debunk-claims-they-were-hiding-details-about-trump-assassination-attempt-2000481577
Google,2024-08-01T16:15:47Z,Google Pixel 9 Pro Fold Might Be Its Thinnest Foldable Yet,Gizmodo.com,https://gizmodo.com/google-pixel-9-pro-fold-thinnest-foldable-at-launch-2000482128
Google,2024-08-16T17:30:04Z,The 4 Most Exciting Features on the Google Pixel Buds Pro 2,Gizmodo.com,https://gizmodo.com/the-4-most-exciting-features-on-the-google-pixel-buds-pro-2-2000486893
Google,2024-08-14T10:15:18Z,Google Pixel Screenshots App Isn’t a Privacy Nightmare Like Microsoft Recall,Gizmodo.com,https://gizmodo.com/google-pixel-screenshots-app-isnt-the-privacy-nightmare-like-microsoft-recall-2000486612
Google,2024-08-13T13:25:16Z,Made by Google 2024: How to Stream Google’s Pixel 9 Event,Gizmodo.com,https://gizmodo.com/how-to-watch-made-by-google-2000486284
Google,2024-08-24T10:00:05Z,"Zoom Docs Is Here, Is It Any Good?",Gizmodo.com,https://gizmodo.com/zoom-docs-vs-google-docs-2000490313
Google,2024-08-06T15:42:44Z,Does everyone hate Google now?,Ars Technica,https://arstechnica.com/culture/2024/08/in-a-divided-america-one-thing-now-unites-hating-google/
Google,1970-01-01T00:00:00Z,[Removed],[Removed],https://removed.com
Google,1970-01-01T00:00:00Z,[Removed],[Removed],https://removed.com
Google,2024-08-06T19:00:14Z,"There Is No Escaping Google’s Gemini, Not Even in the Smart Home",Gizmodo.com,https://gizmodo.com/there-is-no-escaping-googles-gemini-not-even-in-the-smart-home-2000483743
Google,2024-08-14T16:30:03Z,"Geofence Warrants Are Unconstitutional, Federal Appeals Court Rules",Gizmodo.com,https://gizmodo.com/geofence-warrants-are-unconstitutional-federal-appeals-court-rules-2000486954
Google,2024-08-03T12:30:00Z,How to Control Android Auto or Apple CarPlay With Your Voice While Driving,Wired,https://www.wired.com/story/how-to-use-your-voice-to-control-android-auto-or-apple-carplay/
Google,2024-08-06T13:00:41Z,Google’s New $100 TV Streamer Is a Beefed Up Chromecast That Doubles as a Smart Home Hub,Gizmodo.com,https://gizmodo.com/googles-new-100-tv-streamer-is-a-beefed-up-chromecast-that-doubles-as-a-smart-home-hub-2000483358
Google,2024-08-24T14:04:00Z,How to Switch From iPhone to Android (2024),Wired,https://www.wired.com/story/how-to-switch-from-iphone-to-android/
Google,2024-08-16T14:25:16Z,"Fortnite’s Back on the Menu, Boys: Epic Games Store Goes Online for iOS and Android",Gizmodo.com,https://gizmodo.com/epic-games-store-goes-online-ios-and-android-2000487916
Google,2024-08-01T16:35:55Z,Lens in Chrome Could Be Even Better Than Circle to Search,Gizmodo.com,https://gizmodo.com/lens-in-chrome-could-be-even-better-than-circle-to-search-2000482198
Google,2024-08-13T17:00:27Z,Google Pixel Buds Pro 2 Hands On: Buds That Feel as Good as the AirPods Pro 2,Gizmodo.com,https://gizmodo.com/google-pixel-buds-pro-2-hands-on-buds-that-feel-as-good-as-airpods-pro-2-2000486306
