Company,Date,News Headline,Source,URL
Google,2024-08-13T21:15:28Z,Everything Announced at Made by Google 2024: New Pixel 9 Phones and Gemini Live Takes Over Android,Gizmodo.com,https://gizmodo.com/everything-announced-made-by-google-2024-pixel-9-gemini-live-2000486543
Google,2024-08-02T21:43:16Z,The 2025 Explorer is the first Ford to get the new Android-powered infotainment system,The Verge,https://www.theverge.com/2024/8/2/24212211/ford-explorer-2025-digital-experience-android-infortainment
Google,1970-01-01T00:00:00Z,[Removed],[Removed],https://removed.com
Google,2024-08-16T19:21:00Z,Can Google Make Stoplights Smarter?,Slashdot.org,https://tech.slashdot.org/story/24/08/16/180229/can-google-make-stoplights-smarter
Google,2024-08-15T12:00:28Z,Google Pixel 9 vs. Samsung Galaxy S24,Android Central,https://www.androidcentral.com/phones/google-pixel-9-vs-samsung-galaxy-s24
Google,2024-08-14T21:36:46Z,Google Pixel 9 vs. Pixel 9 Pro,Android Central,https://www.androidcentral.com/phones/google-pixel-9-vs-pixel-9-pro
Google,2024-08-15T08:25:24Z,Is the Google Pixel 9 waterproof?,Android Central,https://www.androidcentral.com/phones/is-the-google-pixel-9-waterproof
Google,2024-08-21T13:56:15Z,Is the Google Pixel Watch 3 waterproof?,Android Central,https://www.androidcentral.com/wearables/is-google-pixel-watch-3-waterproof
Google,2024-08-29T12:00:02Z,Google 'Add Me' Explained: Fake Photos? video,CNET,https://www.cnet.com/videos/google-add-me-explained-fake-photos/
Google,2024-08-19T16:30:59Z,Google denies report that it’s discontinuing Fitbit products,Ars Technica,https://arstechnica.com/gadgets/2024/08/google-denies-report-that-its-discontinuing-fitbit-products/
Google,2024-08-28T20:31:27Z,Google AI reintroduces human image generation after historical accuracy outcry,Ars Technica,https://arstechnica.com/ai/2024/08/months-after-controversy-google-ai-can-generate-images-of-humans-again/
Google,2024-08-10T12:00:43Z,"News Weekly: Google is a monopoly, Meta closes a first-party VR studio, new Google hardware, and more",Android Central,https://www.androidcentral.com/apps-software/news-weekly-august-10-2024
Google,2024-08-01T18:41:23Z,The Republican National Committee loses its legal challenge to Gmail,Yahoo Entertainment,https://consent.yahoo.com/v2/collectConsent?sessionId=1_cc-session_1bb4bc95-b6db-442e-92dd-5109bd1571ef
Google,2024-07-31T13:00:00Z,Wix’s AI will now write whole blog posts for you,The Verge,https://www.theverge.com/2024/7/31/24210304/wix-ai-website-builder-seo-blog-posts
Google,2024-08-08T01:35:16Z,How much RAM and storage does the Google TV Streamer have?,Android Central,https://www.androidcentral.com/streaming-tv/google-tv-streamer-how-much-ram-storage
Google,2024-08-09T19:02:31Z,Google Authenticator redesign adds a 'Privacy screen' lock and search,Android Central,https://www.androidcentral.com/apps-software/google-authenticator-security-material-you-redesign
Google,2024-08-13T19:30:52Z,Best Google Pixel 9 Pro Fold screen protectors 2024,Android Central,https://www.androidcentral.com/accessories/best-google-pixel-9-pro-fold-screen-protectors
Google,2024-08-13T21:00:59Z,What color Google Pixel Watch 3 should you buy?,Android Central,https://www.androidcentral.com/wearables/what-color-google-pixel-watch-3-should-you-buy
Google,2024-08-13T17:25:14Z,What color Google Pixel 9 Pro Fold should you buy?,Android Central,https://www.androidcentral.com/phones/what-color-google-pixel-9-pro-fold-should-you-buy
Google,2024-08-06T13:00:15Z,Google Home is leveling up its game with Gemini integration,Android Central,https://www.androidcentral.com/apps-software/google-home-to-become-smarter-with-gemini-help
Google,2024-08-27T15:54:21Z,Google Pixel 10: Rumors and everything we want to see,Android Central,https://www.androidcentral.com/phones/google-pixel-10
Google,2024-08-13T18:30:38Z,Best Google Pixel 9 and Pixel 9 Pro cases 2024,Android Central,https://www.androidcentral.com/accessories/best-google-pixel-9-and-pixel-9-pro-cases
Google,2024-08-13T21:25:33Z,What color Google Pixel Buds Pro 2 should you buy?,Android Central,https://www.androidcentral.com/accessories/earbuds/what-color-google-pixel-buds-pro-2-should-you-buy
Google,2024-08-13T17:40:15Z,Best Google Pixel 9 Pro XL cases 2024,Android Central,https://www.androidcentral.com/accessories/best-google-pixel-9-pro-xl-cases
Google,2024-08-13T22:15:05Z,Best Google Pixel 9 Pro XL screen protectors 2024,Android Central,https://www.androidcentral.com/accessories/best-google-pixel-9-pro-xl-screen-protectors
Google,2024-08-05T20:52:51Z,Maybe you should wait for the Google Pixel 10,Android Central,https://www.androidcentral.com/phones/google-tensor-g4-rumors
Google,2024-08-14T21:15:43Z,Best Google Pixel Watch 3 screen protectors 2024,Android Central,https://www.androidcentral.com/accessories/best-google-pixel-watch-3-screen-protectors
Google,2024-08-15T13:00:23Z,How fast is the Google Pixel 9 charging speed?,Android Central,https://www.androidcentral.com/phones/google-pixel-9-charging-speed
Google,2024-08-15T11:00:47Z,Does the Google Pixel 9 series support Qi2 wireless charging?,Android Central,https://www.androidcentral.com/phones/does-google-pixel-9-support-qi2-wireless-charging
